{
  "profile": "obo-interop/0.5-alpha.1",
  "operation": {
    "request_id": "request-test-denied",
    "action": "supplier.update",
    "resource": "supplier:42",
    "parameters": {
      "credit_limit": 100000
    }
  },
  "grant_jwt": "eyJhbGciOiJFZERTQSIsImtpZCI6Imlzc3Vlci10ZXN0LTEiLCJ0eXAiOiJhdCtqd3QifQ.eyJpc3MiOiJodHRwczovL2lzc3Vlci5leGFtcGxlIiwic3ViIjoidXJuOm9yZzpidXllci5leGFtcGxlIiwiYXVkIjoiaHR0cHM6Ly9zdXBwbGllci5leGFtcGxlL2FwaSIsImlhdCI6MTc5MzAxNTk5MCwiZXhwIjoxNzkzMDE2MzAwLCJqdGkiOiJncmFudC10ZXN0LWRlbmllZCIsImNsaWVudF9pZCI6InVybjphZ2VudDpidXllcjpwcm9jdXJlbWVudCIsInNjb3BlIjoic3VwcGxpZXI6dXBkYXRlIiwib2JvIjp7InByb2ZpbGUiOiJvYm8taW50ZXJvcC8wLjUtYWxwaGEuMSIsIm9wZXJhdG9yX2lkIjoidXJuOm9yZzpvcGVyYXRvci5leGFtcGxlIiwib3BlcmF0aW9uX2RpZ2VzdCI6InNoYTI1NjpmOWViMGMwNTgwY2ZiNDRmNjNjMTBiYTM0Y2VhOGI2YTY4OTU5ZjY3ZWM5OTZlNmRlNzQwZDExN2YyMDQ3ZTMwIn19.8ZsMbwizfLqpk2oqKicJF2_z_Xm2vJML2S3VcNSfh6XF1JKO0iPgbH247neb2SVk1lDY9HmNwZzFJd5v9-bYAQ",
  "policy_jwt": "eyJhbGciOiJFZERTQSIsImtpZCI6InBvbGljeV9hdXRob3JpdHktdGVzdC0xIiwidHlwIjoib2JvLXBvbGljeStqd3QifQ.eyJpc3MiOiJodHRwczovL3BvbGljeS1hdXRob3JpdHkuZXhhbXBsZSIsInN1YiI6InVybjpvcmc6b3BlcmF0b3IuZXhhbXBsZSIsImF1ZCI6Imh0dHBzOi8vc3VwcGxpZXIuZXhhbXBsZS9hcGkiLCJpYXQiOjE3OTMwMTU5NzAsImV4cCI6MTc5MzAxNjMwMCwianRpIjoib2JvLXBvbGljeStqd3QtdGVzdCIsInByb2ZpbGUiOiJvYm8taW50ZXJvcC8wLjUtYWxwaGEuMSIsImFjdGlvbiI6InN1cHBsaWVyLnVwZGF0ZSIsInJlc291cmNlIjoic3VwcGxpZXI6NDIiLCJhbGxvd2VkX2ZpZWxkcyI6WyJjb250YWN0X2VtYWlsIl0sInNjb3BlIjoic3VwcGxpZXI6dXBkYXRlIn0.vKOmMROVhSMXwX-xQpoouHzOPg2sLWcIt-2Nh10be9XQYNr9MpsGzsSJxgh5Oqco1cfzPuF1JHCAEZsP4rveDw",
  "decision_jwt": "eyJhbGciOiJFZERTQSIsImtpZCI6InNlcnZpY2UtdGVzdC0xIiwidHlwIjoib2JvLWRlY2lzaW9uK2p3dCJ9.eyJpc3MiOiJodHRwczovL3NlcnZpY2UuZXhhbXBsZSIsInN1YiI6InVybjpvcmc6YnV5ZXIuZXhhbXBsZSIsImF1ZCI6Imh0dHBzOi8vc3VwcGxpZXIuZXhhbXBsZS9hcGkiLCJpYXQiOjE3OTMwMTYwMDAsImV4cCI6MTc5MzAxNjMwMCwianRpIjoiZGVjaXNpb24tdGVzdC1kZW5pZWQiLCJwcm9maWxlIjoib2JvLWludGVyb3AvMC41LWFscGhhLjEiLCJncmFudF9kaWdlc3QiOiJzaGEyNTY6ZmYyZWUyOWZjYzc0ZDRmY2FiY2U0MzQxZWQwNjhlMWFkN2UxZmM4MzJlNmFlMzE4YTE1ZjZhOGNkZTE5ZGYxZiIsInBvbGljeV9kaWdlc3QiOiJzaGEyNTY6ZWViODYzM2NmNzBiODRhNWI0OTUxMDBmOWExNDI2NDJkOWU4NzMwZTczNmU4ODdhNjIwMGM3ZDg2M2E4NmZhZCIsIm9wZXJhdGlvbl9kaWdlc3QiOiJzaGEyNTY6ZjllYjBjMDU4MGNmYjQ0ZjYzYzEwYmEzNGNlYThiNmE2ODk1OWY2N2VjOTk2ZTZkZTc0MGQxMTdmMjA0N2UzMCIsInJlcXVlc3RfaWQiOiJyZXF1ZXN0LXRlc3QtZGVuaWVkIiwiY2xpZW50X2lkIjoidXJuOmFnZW50OmJ1eWVyOnByb2N1cmVtZW50Iiwib3BlcmF0b3JfaWQiOiJ1cm46b3JnOm9wZXJhdG9yLmV4YW1wbGUiLCJvdXRjb21lIjoiZGVueSIsInJlYXNvbl9jb2RlIjoicG9saWN5LmRlbnkifQ.zJsfqArrpF8fctVX_xnqyaCc-JOVFdI3IJ-iDeceWWRs_Unei02CItcLEwPuEvWxkUuhTOovDqwkJLLxj6MpCw"
}
