{
  "profile": "obo-interop/0.5-alpha.1",
  "operation": {
    "request_id": "request-test-accepted",
    "action": "supplier.update",
    "resource": "supplier:42",
    "parameters": {
      "contact_email": "accounts@example.com"
    }
  },
  "grant_jwt": "eyJhbGciOiJFZERTQSIsImtpZCI6Imlzc3Vlci10ZXN0LTEiLCJ0eXAiOiJhdCtqd3QifQ.eyJpc3MiOiJodHRwczovL2lzc3Vlci5leGFtcGxlIiwic3ViIjoidXJuOm9yZzpidXllci5leGFtcGxlIiwiYXVkIjoiaHR0cHM6Ly9zdXBwbGllci5leGFtcGxlL2FwaSIsImlhdCI6MTc5MzAxNTk5MCwiZXhwIjoxNzkzMDE2MzAwLCJqdGkiOiJncmFudC10ZXN0LWFjY2VwdGVkIiwiY2xpZW50X2lkIjoidXJuOmFnZW50OmJ1eWVyOnByb2N1cmVtZW50Iiwic2NvcGUiOiJzdXBwbGllcjp1cGRhdGUiLCJvYm8iOnsicHJvZmlsZSI6Im9iby1pbnRlcm9wLzAuNS1hbHBoYS4xIiwib3BlcmF0b3JfaWQiOiJ1cm46b3JnOm9wZXJhdG9yLmV4YW1wbGUiLCJvcGVyYXRpb25fZGlnZXN0Ijoic2hhMjU2OjFlNzU0MTc0MTZhM2RjNTM4OTE5YzI3OTZmNGM3NTg3YmM2MjcwMzc5ZmQ3MGUwYmIwNjZhYzEyMWMzMGU3YWUifX0.p0E6m6IPj83FL08i4koEpqjcPwclLhESUEXxjxFeAEJKzGqNcw5AY_7e4Zxa3BNxr00NnzWJn9tLH02stpx0Cw",
  "policy_jwt": "eyJhbGciOiJFZERTQSIsImtpZCI6InBvbGljeV9hdXRob3JpdHktdGVzdC0xIiwidHlwIjoib2JvLXBvbGljeStqd3QifQ.eyJpc3MiOiJodHRwczovL3BvbGljeS1hdXRob3JpdHkuZXhhbXBsZSIsInN1YiI6InVybjpvcmc6b3BlcmF0b3IuZXhhbXBsZSIsImF1ZCI6Imh0dHBzOi8vc3VwcGxpZXIuZXhhbXBsZS9hcGkiLCJpYXQiOjE3OTMwMTU5NzAsImV4cCI6MTc5MzAxNjMwMCwianRpIjoib2JvLXBvbGljeStqd3QtdGVzdCIsInByb2ZpbGUiOiJvYm8taW50ZXJvcC8wLjUtYWxwaGEuMSIsImFjdGlvbiI6InN1cHBsaWVyLnVwZGF0ZSIsInJlc291cmNlIjoic3VwcGxpZXI6NDIiLCJhbGxvd2VkX2ZpZWxkcyI6WyJjb250YWN0X2VtYWlsIl0sInNjb3BlIjoic3VwcGxpZXI6dXBkYXRlIn0.vKOmMROVhSMXwX-xQpoouHzOPg2sLWcIt-2Nh10be9XQYNr9MpsGzsSJxgh5Oqco1cfzPuF1JHCAEZsP4rveDw",
  "decision_jwt": "eyJhbGciOiJFZERTQSIsImtpZCI6InNlcnZpY2UtdGVzdC0xIiwidHlwIjoib2JvLWRlY2lzaW9uK2p3dCJ9.eyJpc3MiOiJodHRwczovL3NlcnZpY2UuZXhhbXBsZSIsInN1YiI6InVybjpvcmc6YnV5ZXIuZXhhbXBsZSIsImF1ZCI6Imh0dHBzOi8vc3VwcGxpZXIuZXhhbXBsZS9hcGkiLCJpYXQiOjE3OTMwMTYwMDAsImV4cCI6MTc5MzAxNjMwMCwianRpIjoiZGVjaXNpb24tdGVzdC1hY2NlcHRlZCIsInByb2ZpbGUiOiJvYm8taW50ZXJvcC8wLjUtYWxwaGEuMSIsImdyYW50X2RpZ2VzdCI6InNoYTI1NjpjZTMyZGQyODRmNTA2N2MyMTU5ZGI2MGI0MTQzNGFmY2I1MGI3NWZlNjJlNWVlNzZkMjRjM2ZlOTgwZDYwMTBlIiwicG9saWN5X2RpZ2VzdCI6InNoYTI1NjplZWI4NjMzY2Y3MGI4NGE1YjQ5NTEwMGY5YTE0MjY0MmQ5ZTg3MzBlNzM2ZTg4N2E2MjAwYzdkODYzYTg2ZmFkIiwib3BlcmF0aW9uX2RpZ2VzdCI6InNoYTI1NjoxZTc1NDE3NDE2YTNkYzUzODkxOWMyNzk2ZjRjNzU4N2JjNjI3MDM3OWZkNzBlMGJiMDY2YWMxMjFjMzBlN2FlIiwicmVxdWVzdF9pZCI6InJlcXVlc3QtdGVzdC1hY2NlcHRlZCIsImNsaWVudF9pZCI6InVybjphZ2VudDpidXllcjpwcm9jdXJlbWVudCIsIm9wZXJhdG9yX2lkIjoidXJuOm9yZzpvcGVyYXRvci5leGFtcGxlIiwib3V0Y29tZSI6ImFsbG93IiwicmVhc29uX2NvZGUiOiJwb2xpY3kuYWxsb3cifQ._9ZfDfzQ_q150gX1T_HoCLeIBL0Q65c49DBAPwBfeD0LwBUtVtMbDv_fyUiRfigTyyHJZMk7kurJgfU9NaXRBw",
  "execution_jwt": "eyJhbGciOiJFZERTQSIsImtpZCI6InNlcnZpY2UtdGVzdC0xIiwidHlwIjoib2JvLWV4ZWN1dGlvbitqd3QifQ.eyJpc3MiOiJodHRwczovL3NlcnZpY2UuZXhhbXBsZSIsInN1YiI6InVybjpvcmc6YnV5ZXIuZXhhbXBsZSIsImF1ZCI6Imh0dHBzOi8vc3VwcGxpZXIuZXhhbXBsZS9hcGkiLCJpYXQiOjE3OTMwMTYwMDEsImV4cCI6MTc5MzAxNjMwMCwianRpIjoib2JvLWV4ZWN1dGlvbitqd3QtdGVzdCIsInByb2ZpbGUiOiJvYm8taW50ZXJvcC8wLjUtYWxwaGEuMSIsImRlY2lzaW9uX2RpZ2VzdCI6InNoYTI1NjpiMzFjYzQ1NDIxOGQ0NDYwMzlhY2ExNDlhOTllYzcwZGE2Nzk5MWE3NzA0OGJmZjM0NjBhZmNkOTg5OTNlZDM5Iiwib3BlcmF0aW9uX2RpZ2VzdCI6InNoYTI1NjoxZTc1NDE3NDE2YTNkYzUzODkxOWMyNzk2ZjRjNzU4N2JjNjI3MDM3OWZkNzBlMGJiMDY2YWMxMjFjMzBlN2FlIiwicmVzcG9uc2VfZGlnZXN0Ijoic2hhMjU2OjM5YmE4Yjk1NDRjMmU1NDMwNDRhZWYwN2NiOTI3Y2Y1MDgxMDZiMDJhOTc4ZjFjNTI5OTgwYTIxYzRiNmM4YzEiLCJyZXF1ZXN0X2lkIjoicmVxdWVzdC10ZXN0LWFjY2VwdGVkIiwib3V0Y29tZSI6ImNvbXBsZXRlZCJ9.bHOi-uWWN4hcxS29m4-ULTJjkeZK660lvFrtycYvNzea-qrL4K6D0s1B22tH2rQLaXehZnUGLteAzHX6GmuZBQ",
  "response": {
    "supplier_id": "supplier:42",
    "record_version": 8,
    "updated": [
      "contact_email"
    ]
  }
}
